{
  "code": "EHE-08",
  "display_name": "EHE-08 (España)",
  "revision": "2026-08",
  "shape_catalog": "en_iso_3766",
  "units": "mm",
  "steel": {
    "default_grade": "B500SD",
    "grades": {
      "B500S":  { "fyk_mpa": 500, "ductility": "S"  },
      "B500SD": { "fyk_mpa": 500, "ductility": "SD" }
    },
    "bar_diameters_mm": [6, 8, 10, 12, 16, 20, 25, 32, 40],
    "mass_per_length_kg_m": { "6":0.222,"8":0.395,"10":0.617,"12":0.888,"16":1.578,
                              "20":2.466,"25":3.854,"32":6.313,"40":9.865 }
  },

  "cover_mm": {
    "_comment": "recubrimiento nominal por elemento y clase de exposicion; el host manda si trae Rebar Cover nativo",
    "by_element": { "foundation": 70, "column": 35, "beam": 30, "slab": 25, "wall": 30, "pile_cap": 75 },
    "by_exposure": { "IIa": 25, "IIb": 30, "IIIa": 35, "IIIb": 40, "IIIc": 45, "IV": 45, "Qa": 40 }
  },

  "bend": {
    "_comment": "diametro de mandril = factor * diametro de barra",
    "mandrel_factor": [
      { "bar_max_mm": 16, "stirrup_factor": 4,  "bar_factor": 4  },
      { "bar_max_mm": 25, "stirrup_factor": 6,  "bar_factor": 7  },
      { "bar_max_mm": 40, "stirrup_factor": 8,  "bar_factor": 10 }
    ],
    "min_straight_after_bend_factor": 5
  },

  "hook": {
    "standard_bend_deg": 90,
    "stirrup_bend_deg": 135,
    "seismic_stirrup_bend_deg": 135,
    "hook_extension_factor": { "90": 12, "135": 10, "180": 4 },
    "min_hook_extension_mm": 70
  },

  "anchorage": {
    "mode": "factor",
    "basic_length_factor": { "good_bond": 40, "poor_bond": 57 },
    "min_factor": 10, "min_mm": 150,
    "compression_factor": 0.7
  },

  "lap": {
    "mode": "factor",
    "tension_factor": { "pct_lapped_le_25": 40, "pct_lapped_gt_50": 57 },
    "compression_factor": 40,
    "min_mm": 200,
    "stagger_offset_mm": 25
  },

  "stirrups": {
    "default_spacing_mm": 200,
    "min_spacing_mm": 75,
    "max_spacing_beam_factor_h": 0.75,
    "max_spacing_column_min": { "factor_min_dim": 1.0, "factor_bar_dia": 12, "abs_mm": 300 },
    "confinement_zone_factor_h": 2.0
  },

  "stock_length_mm": 12000,

  "marking": {
    "mark_format": "{host_mark}-{number:02d}",
    "number_scope": "per_host",
    "dedup_tolerance_mm": 2.0,
    "layer_names": {
      "bottom_x":"Inf-X","bottom_y":"Inf-Y","top_x":"Sup-X","top_y":"Sup-Y",
      "long_top":"Long-Sup","long_bot":"Long-Inf","skin":"Piel",
      "stirrup":"Cerco","crosstie":"Horquilla","dowel":"Espera",
      "edge_u":"Refuerzo-Borde"
    }
  },

  "schedule": {
    "columns": ["mark","count","diameter","shape_code","A","B","C","D","E","R",
                "total_length_mm","unit_mass_kg_m","total_mass_kg"],
    "length_precision_mm": 10,
    "round_cut_length_to_mm": 10,
    "group_by": ["host_mark","layer"]
  }
}
